{"constraints":[],"edges":[{"evidence_ids":["FACT_ID"],"id":"submit","kind":"flow","label":"Submit","source":"visitor","target":"gateway"}],"groups":[],"intent":{"evidence_ids":["FACT_ID"],"kind":"flow","label":"Data path"},"lanes":[],"locale":"en","nodes":[{"evidence_ids":["FACT_ID"],"id":"gateway","kind":"service","label":"Gateway"},{"evidence_ids":["FACT_ID"],"id":"visitor","kind":"actor","label":"Visitor"}],"schema_version":1,"variants":["desktop","mobile"]}
